Article Title,Link
"Watch Andrew Bird, Fiona Apple's Playful 'Left Handed Kisses' Performance",http://www.rollingstone.com/music/news/watch-andrew-bird-fiona-apples-playful-left-handed-kisses-performance-20160316
"Watch Andrew Bird, Fiona Apple Harness Romantic Angst in New Video",http://www.rollingstone.com/music/news/watch-andrew-bird-fiona-apple-harness-romantic-angst-in-new-video-20160314
"Hear Andrew Bird's Lush, Eerie New Song 'Roma Fade'",http://www.rollingstone.com/music/news/hear-andrew-birds-lush-eerie-new-song-roma-fade-20160311
"Andrew Bird Previews St. Vincent Tour, Debuts ""Anonanimal"" Video",http://www.rollingstone.com/music/news/andrew-bird-previews-st-vincent-tour-debuts-anonanimal-video-20090928#ixzz48JpedSNO
RS Live: Inside the Rolling Stone Studio,http://www.rollingstone.com/music/pictures/rs-live-inside-the-rolling-stone-studio-20111102
"Hear Andrew Bird, Fiona Apple's Self-Aware Love Song 'Left Handed Kisses'",http://www.rollingstone.com/music/news/hear-andrew-bird-fiona-apples-self-aware-love-song-left-handed-kisses-20160226
"Andrew Bird Announces New Album 'Are You Serious,' Tour Dates",http://www.rollingstone.com/music/news/andrew-bird-announces-new-album-are-you-serious-tour-dates-20160205
Andrew Bird Still Seeking the Subtleties on Tour,http://www.rollingstone.com/music/news/andrew-bird-still-seeking-the-subtleties-on-tour-20120718
Andrew Bird Turns Up the Volume at the ‘Quietest Show on Earth’,http://www.rollingstone.com/music/news/andrew-bird-turns-up-the-volume-at-the-quietest-show-on-earth-20131011
Andrew Bird Lets the Sunshine In,http://www.rollingstone.com/music/features/after-dark-days-and-heartache-andrew-bird-lets-the-sunshine-in-20120301
"""Eyeoneye""",http://www.rollingstone.com/music/songreviews/eyeoneye-20120113
I Like To Keep Myself In Pain,http://www.rollingstone.com/music/albumreviews/i-like-to-keep-myself-in-pain-20120615
Little Nut Tree,http://www.rollingstone.com/music/albumreviews/little-nut-tree-20111018
Break It Yourself,http://www.rollingstone.com/music/albumreviews/break-it-yourself-20120306
Andrew Bird,http://www.rollingstone.com/music/pictures/bonnaroo-2009-20100605/andrew-bird-53417364
Hottest Live Photos of 2012,http://www.rollingstone.com/music/pictures/the-hottest-live-photos-of-2012-20120111/andrew-bird-0674107
Newport Folk Festival 2010,http://www.rollingstone.com/music/pictures/newport-folk-festival-2010-20100731/andrew-bird-41662724
2012 Outside Lands Music and Arts Festival,http://www.rollingstone.com/music/pictures/2012-outside-lands-music-and-arts-festival-20120811/andrew-bird-0085690
Coachella 2012 Weekend One Live Photos,http://www.rollingstone.com/music/pictures/live-photos-from-coachella-2012-weekend-one-20120414/andrew-bird-0065821
New Orleans Jazz & Heritage Music Festival 2013,http://www.rollingstone.com/music/pictures/new-orleans-jazz-heritage-music-festival-2013-20130427/andrew-bird-0983674
Andrew Bird's Bowl of Fire Photos,http://www.rollingstone.com/music/pictures/andrew-birds-bowl-of-fire-photos-20001207
